Category_Set,Category_Occurrences,Total_Examples,percent_of_entries,Entity_Number
Plan members covered by Social Security,1984,2720,0.7294117647058823,-1
Plan members not covered by Social Security,688,2720,0.2529411764705882,-1
Most plan members covered by Social Security (each participating county or district decides their own SS participation).,16,2720,0.0058823529411764,-1
Most plan members covered by Social Security (each participating district decides their own SS participation).,16,2720,0.0058823529411764,-1
"Plan A members are not covered by Social Security, Plan B members are covered by Social Security",16,2720,0.0058823529411764,-1
