Category_Set,Category_Occurrences,Total_Examples,percent_of_entries,Entity_Number
Final consumption expenditure,9234,80583,0.1145899259148952,-1
Gross Domestic Product (GDP),9234,80583,0.1145899259148952,-1
Exports of goods and services,9213,80583,0.1143293250437437,-1
Imports of goods and services,9192,80583,0.1140687241725922,-1
Household consumption expenditure (including Non-profit institutions serving households),9188,80583,0.1140190859114205,-1
General government final consumption expenditure,9188,80583,0.1140190859114205,-1
Gross fixed capital formation (including Acquisitions less disposals of valuables),9188,80583,0.1140190859114205,-1
Gross capital formation,9188,80583,0.1140190859114205,-1
Changes in inventories,6958,80583,0.0863457553081915,-1
